<?xml version="1.0" encoding="UTF-8"?>
<!DOCTYPE datadictionary PUBLIC "-//MathWorks//DTD MBCDATADICTIONARY 1.0 Alpha//EN"
"http://www.mathworks.com/namespace/mbcdatadictionary/v1/datadictionary.dtd">

<datadictionary>

<organisation>The MathWorks</organisation>
<version>1.0</version>

<value>
     <name>N</name>
     <alias>engine_speed</alias>
     <description>Engine speed (rpm)</description>
     <min>500</min>
     <max>6500</max>
     <setpoint>2500</setpoint>
</value>

<value>
     <name>L</name>
     <alias>load</alias>
     <alias>Load</alias>
     <description>Engine load (ratio)</description>
     <min>0.1</min>
     <max>1</max>
     <setpoint>0.4</setpoint>
</value>

<value>
     <name>A</name>
     <alias>afr</alias>
     <alias>AFR</alias>
     <description>Air-fuel ratio (ratio</description>
     <min>11</min>
     <max>17</max>
     <setpoint>14.35</setpoint>
</value>

<constant>
     <name>stoich</name>
     <description>Stoichiometric constant</description>
     <val>14.35</val>
</constant>

</datadictionary>