<?xml version="1.0" encoding="UTF-8"?>
<!DOCTYPE datadictionary PUBLIC "-//MathWorks//DTD MBCDATADICTIONARY 1.0 Alpha//EN"
	"http://www.mathworks.com/namespace/mbcdatadictionary/v1/datadictionary.dtd">

<datadictionary>

<organisation>The MathWorks</organisation>
<version>1.0</version>

<value>
	<name>RPM</name>
	<min>0</min>
	<max>20000</max>
	<unit>rpm</unit>
</value>
	
<symvalue>
	<name>x</name>
	<definition>y+z</definition>
	<unit>1</unit>
</symvalue>

</datadictionary>
